0000:00:00.0 Host bridge: Intel Corporation Mobile 915GM/PM/GMS/910GML Express Processor to DRAM Controller (rev 03)
	Subsystem: Dell: Unknown device 0182
	Control: I/O- Mem+ BusMaster+ SpecCycle- MemWINV- VGASnoop- ParErr- Stepping- SERR- FastB2B-
	Status: Cap+ 66MHz- UDF- FastB2B+ ParErr- DEVSEL=fast >TAbort- <TAbort- <MAbort+ >SERR- <PERR-
	Latency: 0
	Capabilities: [e0] #09 [2109]

0000:00:02.0 VGA compatible controller: Intel Corporation Mobile 915GM/GMS/910GML Express Graphics Controller (rev 03) (prog-if 00 [VGA])
	Subsystem: Dell: Unknown device 0182
	Control: I/O+ Mem+ BusMaster+ SpecCycle- MemWINV- VGASnoop- ParErr- Stepping- SERR- FastB2B-
	Status: Cap+ 66MHz- UDF- FastB2B+ ParErr- DEVSEL=fast >TAbort- <TAbort- <MAbort- >SERR- <PERR-
	Latency: 0
	Interrupt: pin A routed to IRQ 11
	Region 0: Memory at dff00000 (32-bit, non-prefetchable) [size=512K]
	Region 1: I/O ports at ec38 [size=8]
	Region 2: Memory at c0000000 (32-bit, prefetchable) [size=256M]
	Region 3: Memory at dfec0000 (32-bit, non-prefetchable) [size=256K]
	Capabilities: [d0] Power Management version 2
		Flags: PMEClk- DSI+ D1- D2- AuxCurrent=0mA PME(D0-,D1-,D2-,D3hot-,D3cold-)
		Status: D0 PME-Enable- DSel=0 DScale=0 PME-

0000:00:02.1 Display controller: Intel Corporation Mobile 915GM/GMS/910GML Express Graphics Controller (rev 03)
	Subsystem: Dell: Unknown device 0182
	Control: I/O+ Mem+ BusMaster+ SpecCycle- MemWINV- VGASnoop- ParErr- Stepping- SERR- FastB2B-
	Status: Cap+ 66MHz- UDF- FastB2B+ ParErr- DEVSEL=fast >TAbort- <TAbort- <MAbort- >SERR- <PERR-
	Latency: 0
	Region 0: Memory at dff80000 (32-bit, non-prefetchable) [size=512K]
	Capabilities: [d0] Power Management version 2
		Flags: PMEClk- DSI+ D1- D2- AuxCurrent=0mA PME(D0-,D1-,D2-,D3hot-,D3cold-)
		Status: D0 PME-Enable- DSel=0 DScale=0 PME-

0000:00:1c.0 PCI bridge: Intel Corporation 82801FB/FBM/FR/FW/FRW (ICH6 Family) PCI Express Port 1 (rev 03) (prog-if 00 [Normal decode])
	Control: I/O+ Mem+ BusMaster+ SpecCycle- MemWINV- VGASnoop- ParErr- Stepping- SERR- FastB2B-
	Status: Cap+ 66MHz- UDF- FastB2B- ParErr- DEVSEL=fast >TAbort- <TAbort- <MAbort- >SERR- <PERR-
	Latency: 0, Cache Line Size: 0x10 (64 bytes)
	Bus: primary=00, secondary=02, subordinate=02, sec-latency=0
	Memory behind bridge: dfd00000-dfdfffff
	BridgeCtl: Parity- SERR+ NoISA- VGA- MAbort- >Reset- FastB2B-
	Capabilities: [40] #10 [0141]
	Capabilities: [80] Message Signalled Interrupts: 64bit- Queue=0/0 Enable-
		Address: 00000000  Data: 0000
	Capabilities: [90] #0d [0000]
	Capabilities: [a0] Power Management version 2
		Flags: PMEClk- DSI- D1- D2- AuxCurrent=0mA PME(D0+,D1-,D2-,D3hot+,D3cold+)
		Status: D0 PME-Enable- DSel=0 DScale=0 PME-

0000:00:1d.0 USB Controller: Intel Corporation 82801FB/FBM/FR/FW/FRW (ICH6 Family) USB UHCI #1 (rev 03) (prog-if 00 [UHCI])
	Subsystem: Dell: Unknown device 0182
	Control: I/O+ Mem- BusMaster+ SpecCycle- MemWINV- VGASnoop- ParErr- Stepping- SERR- FastB2B-
	Status: Cap- 66MHz- UDF- FastB2B+ ParErr- DEVSEL=medium >TAbort- <TAbort- <MAbort- >SERR- <PERR-
	Latency: 0
	Interrupt: pin A routed to IRQ 11
	Region 4: I/O ports at bf80 [size=32]

0000:00:1d.1 USB Controller: Intel Corporation 82801FB/FBM/FR/FW/FRW (ICH6 Family) USB UHCI #2 (rev 03) (prog-if 00 [UHCI])
	Subsystem: Dell: Unknown device 0182
	Control: I/O+ Mem- BusMaster+ SpecCycle- MemWINV- VGASnoop- ParErr- Stepping- SERR- FastB2B-
	Status: Cap- 66MHz- UDF- FastB2B+ ParErr- DEVSEL=medium >TAbort- <TAbort- <MAbort- >SERR- <PERR-
	Latency: 0
	Interrupt: pin B routed to IRQ 5
	Region 4: I/O ports at bf60 [size=32]

0000:00:1d.2 USB Controller: Intel Corporation 82801FB/FBM/FR/FW/FRW (ICH6 Family) USB UHCI #3 (rev 03) (prog-if 00 [UHCI])
	Subsystem: Dell: Unknown device 0182
	Control: I/O+ Mem- BusMaster+ SpecCycle- MemWINV- VGASnoop- ParErr- Stepping- SERR- FastB2B-
	Status: Cap- 66MHz- UDF- FastB2B+ ParErr- DEVSEL=medium >TAbort- <TAbort- <MAbort- >SERR- <PERR-
	Latency: 0
	Interrupt: pin C routed to IRQ 9
	Region 4: I/O ports at bf40 [size=32]

0000:00:1d.3 USB Controller: Intel Corporation 82801FB/FBM/FR/FW/FRW (ICH6 Family) USB UHCI #4 (rev 03) (prog-if 00 [UHCI])
	Subsystem: Dell: Unknown device 0182
	Control: I/O+ Mem- BusMaster+ SpecCycle- MemWINV- VGASnoop- ParErr- Stepping- SERR- FastB2B-
	Status: Cap- 66MHz- UDF- FastB2B+ ParErr- DEVSEL=medium >TAbort- <TAbort- <MAbort- >SERR- <PERR-
	Latency: 0
	Interrupt: pin D routed to IRQ 5
	Region 4: I/O ports at bf20 [size=32]

0000:00:1d.7 USB Controller: Intel Corporation 82801FB/FBM/FR/FW/FRW (ICH6 Family) USB2 EHCI Controller (rev 03) (prog-if 20 [EHCI])
	Subsystem: Dell: Unknown device 0182
	Control: I/O- Mem+ BusMaster+ SpecCycle- MemWINV- VGASnoop- ParErr- Stepping- SERR+ FastB2B-
	Status: Cap+ 66MHz- UDF- FastB2B+ ParErr- DEVSEL=medium >TAbort- <TAbort- <MAbort- >SERR- <PERR-
	Latency: 0
	Interrupt: pin A routed to IRQ 11
	Region 0: Memory at ffa80800 (32-bit, non-prefetchable) [size=1K]
	Capabilities: [50] Power Management version 2
		Flags: PMEClk- DSI- D1- D2- AuxCurrent=375mA PME(D0+,D1-,D2-,D3hot+,D3cold+)
		Status: D0 PME-Enable- DSel=0 DScale=0 PME-
	Capabilities: [58] #0a [20a0]

0000:00:1e.0 PCI bridge: Intel Corporation 82801 Mobile PCI Bridge (rev d3) (prog-if 01 [Subtractive decode])
	Control: I/O+ Mem+ BusMaster+ SpecCycle- MemWINV- VGASnoop- ParErr- Stepping- SERR+ FastB2B-
	Status: Cap+ 66MHz- UDF- FastB2B- ParErr- DEVSEL=fast >TAbort- <TAbort- <MAbort- >SERR- <PERR-
	Latency: 0
	Bus: primary=00, secondary=03, subordinate=04, sec-latency=32
	Memory behind bridge: dfc00000-dfcfffff
	Prefetchable memory behind bridge: 0000000050000000-0000000051f00000
	BridgeCtl: Parity- SERR+ NoISA- VGA- MAbort- >Reset- FastB2B-
	Capabilities: [50] #0d [0000]

0000:00:1e.2 Multimedia audio controller: Intel Corporation 82801FB/FBM/FR/FW/FRW (ICH6 Family) AC'97 Audio Controller (rev 03)
	Subsystem: Dell: Unknown device 0182
	Control: I/O+ Mem+ BusMaster+ SpecCycle- MemWINV- VGASnoop- ParErr- Stepping- SERR- FastB2B-
	Status: Cap+ 66MHz- UDF- FastB2B+ ParErr- DEVSEL=medium >TAbort- <TAbort- <MAbort- >SERR- <PERR-
	Latency: 0
	Interrupt: pin A routed to IRQ 11
	Region 0: I/O ports at ed00 [size=256]
	Region 1: I/O ports at ec40 [size=64]
	Region 2: Memory at dfebfe00 (32-bit, non-prefetchable) [size=512]
	Region 3: Memory at dfebfd00 (32-bit, non-prefetchable) [size=256]
	Capabilities: [50] Power Management version 2
		Flags: PMEClk- DSI- D1- D2- AuxCurrent=375mA PME(D0+,D1-,D2-,D3hot+,D3cold+)
		Status: D0 PME-Enable- DSel=0 DScale=0 PME-

0000:00:1e.3 Modem: Intel Corporation 82801FB/FBM/FR/FW/FRW (ICH6 Family) AC'97 Modem Controller (rev 03) (prog-if 00 [Generic])
	Subsystem: Conexant: Unknown device 5423
	Control: I/O+ Mem- BusMaster+ SpecCycle- MemWINV- VGASnoop- ParErr- Stepping- SERR- FastB2B-
	Status: Cap+ 66MHz- UDF- FastB2B+ ParErr- DEVSEL=medium >TAbort- <TAbort- <MAbort- >SERR- <PERR-
	Latency: 0
	Interrupt: pin B routed to IRQ 10
	Region 0: I/O ports at ee00 [size=256]
	Region 1: I/O ports at ec80 [size=128]
	Capabilities: [50] Power Management version 2
		Flags: PMEClk- DSI- D1- D2- AuxCurrent=375mA PME(D0+,D1-,D2-,D3hot+,D3cold+)
		Status: D0 PME-Enable- DSel=0 DScale=0 PME-

0000:00:1f.0 ISA bridge: Intel Corporation 82801FBM (ICH6M) LPC Interface Bridge (rev 03)
	Subsystem: Dell: Unknown device 0182
	Control: I/O+ Mem+ BusMaster+ SpecCycle- MemWINV- VGASnoop- ParErr- Stepping- SERR+ FastB2B-
	Status: Cap- 66MHz- UDF- FastB2B- ParErr- DEVSEL=medium >TAbort- <TAbort- <MAbort- >SERR- <PERR-
	Latency: 0

0000:00:1f.2 IDE interface: Intel Corporation 82801FBM (ICH6M) SATA Controller (rev 03) (prog-if 80 [Master])
	Subsystem: Dell: Unknown device 0182
	Control: I/O+ Mem- BusMaster+ SpecCycle- MemWINV- VGASnoop- ParErr- Stepping- SERR- FastB2B-
	Status: Cap+ 66MHz+ UDF- FastB2B+ ParErr- DEVSEL=medium >TAbort- <TAbort- <MAbort- >SERR- <PERR-
	Latency: 0
	Interrupt: pin B routed to IRQ 5
	Region 0: I/O ports at <ignored>
	Region 1: I/O ports at <ignored>
	Region 2: I/O ports at <ignored>
	Region 3: I/O ports at <ignored>
	Region 4: I/O ports at bfa0 [size=16]
	Capabilities: [70] Power Management version 2
		Flags: PMEClk- DSI- D1- D2- AuxCurrent=0mA PME(D0-,D1-,D2-,D3hot+,D3cold-)
		Status: D0 PME-Enable- DSel=0 DScale=0 PME-

0000:02:00.0 Ethernet controller: Broadcom Corporation NetXtreme BCM5751 Gigabit Ethernet PCI Express (rev 01)
	Subsystem: Dell Latitude D610
	Control: I/O- Mem+ BusMaster+ SpecCycle- MemWINV- VGASnoop- ParErr- Stepping- SERR+ FastB2B-
	Status: Cap+ 66MHz- UDF- FastB2B- ParErr- DEVSEL=fast >TAbort- <TAbort- <MAbort- >SERR- <PERR-
	Latency: 0, Cache Line Size: 0x10 (64 bytes)
	Interrupt: pin A routed to IRQ 11
	Region 0: Memory at dfdf0000 (64-bit, non-prefetchable) [size=64K]
	Capabilities: [48] Power Management version 2
		Flags: PMEClk- DSI- D1- D2- AuxCurrent=0mA PME(D0-,D1-,D2-,D3hot+,D3cold+)
		Status: D0 PME-Enable- DSel=0 DScale=1 PME-
	Capabilities: [50] Vital Product Data
	Capabilities: [58] Message Signalled Interrupts: 64bit+ Queue=0/3 Enable-
		Address: fffff1dbdbeeeeec  Data: cfbf
	Capabilities: [d0] #10 [0001]

0000:03:01.0 CardBus bridge: Texas Instruments PCI6515 Cardbus Controller
	Subsystem: Dell: Unknown device 0182
	Control: I/O+ Mem+ BusMaster+ SpecCycle- MemWINV- VGASnoop- ParErr- Stepping- SERR- FastB2B-
	Status: Cap+ 66MHz- UDF- FastB2B- ParErr- DEVSEL=medium >TAbort- <TAbort- <MAbort- >SERR- <PERR-
	Latency: 64, Cache Line Size: 0x10 (64 bytes)
	Interrupt: pin A routed to IRQ 5
	Region 0: Memory at dfc00000 (32-bit, non-prefetchable) [size=4K]
	Bus: primary=03, secondary=04, subordinate=07, sec-latency=176
	Memory window 0: 50000000-51fff000 (prefetchable)
	Memory window 1: 52000000-53fff000 (prefetchable)
	I/O window 0: 00001400-000014ff
	I/O window 1: 00001800-000018ff
	BridgeCtl: Parity- SERR- ISA- VGA- MAbort- >Reset+ 16bInt- PostWrite+
	16-bit legacy interface ports at 0001

0000:03:01.5 Communication controller: Texas Instruments PCI6515 SmartCard Controller
	Subsystem: Dell: Unknown device 0182
	Control: I/O- Mem+ BusMaster- SpecCycle- MemWINV- VGASnoop- ParErr- Stepping- SERR+ FastB2B-
	Status: Cap+ 66MHz- UDF- FastB2B- ParErr- DEVSEL=medium >TAbort- <TAbort- <MAbort- >SERR- <PERR-
	Interrupt: pin A routed to IRQ 5
	Region 0: Memory at dfcfd000 (32-bit, non-prefetchable) [size=4K]
	Region 1: Memory at dfcfe000 (32-bit, non-prefetchable) [size=4K]
	Capabilities: [44] Power Management version 2
		Flags: PMEClk- DSI- D1+ D2+ AuxCurrent=0mA PME(D0+,D1+,D2+,D3hot+,D3cold-)
		Status: D0 PME-Enable- DSel=0 DScale=0 PME-

0000:03:03.0 Network controller: Intel Corporation PRO/Wireless 2915ABG MiniPCI Adapter (rev 05)
	Subsystem: Intel Corporation: Unknown device 1021
	Control: I/O- Mem+ BusMaster+ SpecCycle- MemWINV+ VGASnoop- ParErr- Stepping- SERR+ FastB2B-
	Status: Cap+ 66MHz- UDF- FastB2B+ ParErr- DEVSEL=medium >TAbort- <TAbort- <MAbort- >SERR- <PERR-
	Latency: 64 (750ns min, 6000ns max), Cache Line Size: 0x10 (64 bytes)
	Interrupt: pin A routed to IRQ 10
	Region 0: Memory at dfcff000 (32-bit, non-prefetchable) [size=4K]
	Capabilities: [dc] Power Management version 2
		Flags: PMEClk- DSI+ D1- D2- AuxCurrent=0mA PME(D0+,D1-,D2-,D3hot+,D3cold+)
		Status: D0 PME-Enable- DSel=0 DScale=1 PME-

