0000:00:00.0 Host bridge: Intel Corporation 82855PM Processor to I/O Controller (rev 03)
	Subsystem: Acer Incorporated [ALI]: Unknown device 001f
	Control: I/O- Mem+ BusMaster+ SpecCycle- MemWINV- VGASnoop- ParErr- Stepping- SERR+ FastB2B-
	Status: Cap+ 66MHz- UDF- FastB2B+ ParErr- DEVSEL=fast >TAbort- <TAbort- <MAbort+ >SERR- <PERR-
	Latency: 0
	Region 0: Memory at e0000000 (32-bit, prefetchable) [size=256M]
	Capabilities: [e4] #09 [f104]
	Capabilities: [a0] AGP version 2.0
		Status: RQ=32 Iso- ArqSz=0 Cal=0 SBA+ ITACoh- GART64- HTrans- 64bit- FW+ AGP3- Rate=x1,x2,x4
		Command: RQ=1 ArqSz=0 Cal=0 SBA+ AGP+ GART64- 64bit- FW- Rate=x4

0000:00:01.0 PCI bridge: Intel Corporation 82855PM Processor to AGP Controller (rev 03) (prog-if 00 [Normal decode])
	Control: I/O+ Mem+ BusMaster+ SpecCycle- MemWINV- VGASnoop- ParErr- Stepping- SERR+ FastB2B-
	Status: Cap- 66MHz+ UDF- FastB2B+ ParErr- DEVSEL=fast >TAbort- <TAbort- <MAbort- >SERR- <PERR-
	Latency: 96
	Bus: primary=00, secondary=01, subordinate=01, sec-latency=64
	I/O behind bridge: 00003000-00003fff
	Memory behind bridge: d0100000-d01fffff
	Prefetchable memory behind bridge: d8000000-dfffffff
	BridgeCtl: Parity- SERR- NoISA+ VGA+ MAbort- >Reset- FastB2B-

0000:00:1d.0 USB Controller: Intel Corporation 82801DB/DBL/DBM (ICH4/ICH4-L/ICH4-M) USB UHCI Controller #1 (rev 03) (prog-if 00 [UHCI])
	Subsystem: Acer Incorporated [ALI]: Unknown device 001f
	Control: I/O+ Mem- BusMaster+ SpecCycle- MemWINV- VGASnoop- ParErr- Stepping- SERR- FastB2B-
	Status: Cap- 66MHz- UDF- FastB2B+ ParErr- DEVSEL=medium >TAbort- <TAbort- <MAbort- >SERR- <PERR-
	Latency: 0
	Interrupt: pin A routed to IRQ 10
	Region 4: I/O ports at 1800 [size=32]

0000:00:1d.1 USB Controller: Intel Corporation 82801DB/DBL/DBM (ICH4/ICH4-L/ICH4-M) USB UHCI Controller #2 (rev 03) (prog-if 00 [UHCI])
	Subsystem: Acer Incorporated [ALI]: Unknown device 001f
	Control: I/O+ Mem- BusMaster+ SpecCycle- MemWINV- VGASnoop- ParErr- Stepping- SERR- FastB2B-
	Status: Cap- 66MHz- UDF- FastB2B+ ParErr- DEVSEL=medium >TAbort- <TAbort- <MAbort- >SERR- <PERR-
	Latency: 0
	Interrupt: pin B routed to IRQ 5
	Region 4: I/O ports at 1820 [size=32]

0000:00:1d.2 USB Controller: Intel Corporation 82801DB/DBL/DBM (ICH4/ICH4-L/ICH4-M) USB UHCI Controller #3 (rev 03) (prog-if 00 [UHCI])
	Subsystem: Acer Incorporated [ALI]: Unknown device 001f
	Control: I/O+ Mem- BusMaster+ SpecCycle- MemWINV- VGASnoop- ParErr- Stepping- SERR- FastB2B-
	Status: Cap- 66MHz- UDF- FastB2B+ ParErr- DEVSEL=medium >TAbort- <TAbort- <MAbort- >SERR- <PERR-
	Latency: 0
	Interrupt: pin C routed to IRQ 10
	Region 4: I/O ports at 1840 [size=32]

0000:00:1d.7 USB Controller: Intel Corporation 82801DB/DBM (ICH4/ICH4-M) USB2 EHCI Controller (rev 03) (prog-if 20 [EHCI])
	Subsystem: Acer Incorporated [ALI]: Unknown device 001f
	Control: I/O- Mem+ BusMaster+ SpecCycle- MemWINV- VGASnoop- ParErr- Stepping- SERR+ FastB2B-
	Status: Cap+ 66MHz- UDF- FastB2B+ ParErr- DEVSEL=medium >TAbort- <TAbort- <MAbort- >SERR- <PERR-
	Latency: 0
	Interrupt: pin D routed to IRQ 10
	Region 0: Memory at d0000000 (32-bit, non-prefetchable) [size=1K]
	Capabilities: [50] Power Management version 2
		Flags: PMEClk- DSI- D1- D2- AuxCurrent=375mA PME(D0+,D1-,D2-,D3hot+,D3cold+)
		Status: D0 PME-Enable- DSel=0 DScale=0 PME-
	Capabilities: [58] #0a [2080]

0000:00:1e.0 PCI bridge: Intel Corporation 82801 Mobile PCI Bridge (rev 83) (prog-if 00 [Normal decode])
	Control: I/O+ Mem+ BusMaster+ SpecCycle- MemWINV- VGASnoop- ParErr- Stepping- SERR+ FastB2B-
	Status: Cap- 66MHz- UDF- FastB2B+ ParErr- DEVSEL=fast >TAbort- <TAbort- <MAbort- >SERR- <PERR+
	Latency: 0
	Bus: primary=00, secondary=02, subordinate=02, sec-latency=64
	I/O behind bridge: 00004000-00004fff
	Memory behind bridge: d0200000-d05fffff
	Prefetchable memory behind bridge: 40000000-43ffffff
	BridgeCtl: Parity- SERR- NoISA+ VGA- MAbort- >Reset- FastB2B-

0000:00:1f.0 ISA bridge: Intel Corporation 82801DBM (ICH4-M) LPC Interface Bridge (rev 03)
	Control: I/O+ Mem+ BusMaster+ SpecCycle+ MemWINV- VGASnoop- ParErr- Stepping- SERR- FastB2B-
	Status: Cap- 66MHz- UDF- FastB2B+ ParErr- DEVSEL=medium >TAbort- <TAbort- <MAbort- >SERR- <PERR-
	Latency: 0

0000:00:1f.1 IDE interface: Intel Corporation 82801DBM (ICH4-M) IDE Controller (rev 03) (prog-if 8a [Master SecP PriP])
	Subsystem: Acer Incorporated [ALI]: Unknown device 001f
	Control: I/O+ Mem+ BusMaster+ SpecCycle- MemWINV- VGASnoop- ParErr- Stepping- SERR- FastB2B-
	Status: Cap- 66MHz- UDF- FastB2B+ ParErr- DEVSEL=medium >TAbort- <TAbort- <MAbort- >SERR- <PERR-
	Latency: 0
	Interrupt: pin A routed to IRQ 10
	Region 0: I/O ports at <unassigned>
	Region 1: I/O ports at <unassigned>
	Region 2: I/O ports at <unassigned>
	Region 3: I/O ports at <unassigned>
	Region 4: I/O ports at 1860 [size=16]
	Region 5: Memory at 44000000 (32-bit, non-prefetchable) [size=1K]

0000:00:1f.3 SMBus: Intel Corporation 82801DB/DBL/DBM (ICH4/ICH4-L/ICH4-M) SMBus Controller (rev 03)
	Subsystem: Acer Incorporated [ALI]: Unknown device 001f
	Control: I/O+ Mem- BusMaster- SpecCycle- MemWINV- VGASnoop- ParErr- Stepping- SERR- FastB2B-
	Status: Cap- 66MHz- UDF- FastB2B+ ParErr- DEVSEL=medium >TAbort- <TAbort- <MAbort- >SERR- <PERR-
	Interrupt: pin B routed to IRQ 10
	Region 4: I/O ports at 1880 [size=32]

0000:00:1f.5 Multimedia audio controller: Intel Corporation 82801DB/DBL/DBM (ICH4/ICH4-L/ICH4-M) AC'97 Audio Controller (rev 03)
	Subsystem: Acer Incorporated [ALI]: Unknown device 001f
	Control: I/O+ Mem+ BusMaster+ SpecCycle- MemWINV- VGASnoop- ParErr- Stepping- SERR- FastB2B-
	Status: Cap+ 66MHz- UDF- FastB2B+ ParErr- DEVSEL=medium >TAbort- <TAbort- <MAbort- >SERR- <PERR-
	Latency: 0
	Interrupt: pin B routed to IRQ 10
	Region 0: I/O ports at 1c00 [size=256]
	Region 1: I/O ports at 18c0 [size=64]
	Region 2: Memory at d0000c00 (32-bit, non-prefetchable) [size=512]
	Region 3: Memory at d0000800 (32-bit, non-prefetchable) [size=256]
	Capabilities: [50] Power Management version 2
		Flags: PMEClk- DSI- D1- D2- AuxCurrent=375mA PME(D0+,D1-,D2-,D3hot+,D3cold+)
		Status: D0 PME-Enable- DSel=0 DScale=0 PME-

0000:00:1f.6 Modem: Intel Corporation 82801DB/DBL/DBM (ICH4/ICH4-L/ICH4-M) AC'97 Modem Controller (rev 03) (prog-if 00 [Generic])
	Subsystem: Acer Incorporated [ALI]: Unknown device 001f
	Control: I/O+ Mem- BusMaster+ SpecCycle- MemWINV- VGASnoop- ParErr- Stepping- SERR- FastB2B-
	Status: Cap+ 66MHz- UDF- FastB2B+ ParErr- DEVSEL=medium >TAbort- <TAbort- <MAbort- >SERR- <PERR-
	Latency: 0
	Interrupt: pin B routed to IRQ 10
	Region 0: I/O ports at 2400 [size=256]
	Region 1: I/O ports at 2000 [size=128]
	Capabilities: [50] Power Management version 2
		Flags: PMEClk- DSI- D1- D2- AuxCurrent=375mA PME(D0+,D1-,D2-,D3hot+,D3cold+)
		Status: D0 PME-Enable- DSel=0 DScale=0 PME-

0000:01:00.0 VGA compatible controller: ATI Technologies Inc Radeon R250 Lf [FireGL 9000] (rev 01) (prog-if 00 [VGA])
	Subsystem: Acer Incorporated [ALI]: Unknown device 001f
	Control: I/O+ Mem+ BusMaster+ SpecCycle- MemWINV- VGASnoop- ParErr- Stepping+ SERR+ FastB2B+
	Status: Cap+ 66MHz+ UDF- FastB2B+ ParErr- DEVSEL=medium >TAbort- <TAbort- <MAbort- >SERR- <PERR-
	Latency: 66 (2000ns min), Cache Line Size: 0x08 (32 bytes)
	Interrupt: pin A routed to IRQ 10
	Region 0: Memory at d8000000 (32-bit, prefetchable) [size=128M]
	Region 1: I/O ports at 3000 [size=256]
	Region 2: Memory at d0100000 (32-bit, non-prefetchable) [size=64K]
	Expansion ROM at d0120000 [disabled] [size=128K]
	Capabilities: [58] AGP version 2.0
		Status: RQ=48 Iso- ArqSz=0 Cal=0 SBA+ ITACoh- GART64- HTrans- 64bit- FW+ AGP3- Rate=x1,x2,x4
		Command: RQ=32 ArqSz=0 Cal=0 SBA+ AGP+ GART64- 64bit- FW- Rate=x4
	Capabilities: [50] Power Management version 2
		Flags: PMEClk- DSI- D1+ D2+ AuxCurrent=0mA PME(D0-,D1-,D2-,D3hot-,D3cold-)
		Status: D0 PME-Enable- DSel=0 DScale=0 PME-

0000:02:02.0 Ethernet controller: Broadcom Corporation BCM4401 100Base-T (rev 01)
	Subsystem: Acer Incorporated [ALI]: Unknown device 001f
	Control: I/O- Mem+ BusMaster+ SpecCycle- MemWINV- VGASnoop- ParErr- Stepping- SERR+ FastB2B-
	Status: Cap+ 66MHz- UDF- FastB2B- ParErr- DEVSEL=fast >TAbort- <TAbort- <MAbort- >SERR- <PERR-
	Latency: 64
	Interrupt: pin A routed to IRQ 5
	Region 0: Memory at d0204000 (32-bit, non-prefetchable) [size=8K]
	Capabilities: [40] Power Management version 2
		Flags: PMEClk- DSI- D1+ D2+ AuxCurrent=375mA PME(D0+,D1+,D2+,D3hot+,D3cold+)
		Status: D0 PME-Enable- DSel=0 DScale=2 PME-

0000:02:04.0 Network controller: Intel Corporation PRO/Wireless LAN 2100 3B Mini PCI Adapter (rev 04)
	Subsystem: Intel Corporation MIM2000/Centrino
	Control: I/O- Mem+ BusMaster+ SpecCycle- MemWINV+ VGASnoop- ParErr- Stepping- SERR+ FastB2B-
	Status: Cap+ 66MHz- UDF- FastB2B+ ParErr- DEVSEL=medium >TAbort- <TAbort- <MAbort- >SERR- <PERR-
	Latency: 64 (500ns min, 8500ns max), Cache Line Size: 0x08 (32 bytes)
	Interrupt: pin A routed to IRQ 10
	Region 0: Memory at d0206000 (32-bit, non-prefetchable) [size=4K]
	Capabilities: [dc] Power Management version 2
		Flags: PMEClk- DSI- D1- D2- AuxCurrent=0mA PME(D0-,D1-,D2-,D3hot-,D3cold-)
		Status: D0 PME-Enable- DSel=0 DScale=1 PME-

0000:02:06.0 CardBus bridge: O2 Micro, Inc. OZ711M1/MC1 4-in-1 MemoryCardBus Controller (rev 20)
	Subsystem: Acer Incorporated [ALI]: Unknown device 001f
	Control: I/O+ Mem+ BusMaster+ SpecCycle- MemWINV- VGASnoop- ParErr- Stepping+ SERR+ FastB2B-
	Status: Cap+ 66MHz- UDF- FastB2B- ParErr- DEVSEL=slow >TAbort- <TAbort- <MAbort- >SERR- <PERR-
	Latency: 64
	Interrupt: pin A routed to IRQ 10
	Region 0: Memory at d0207000 (32-bit, non-prefetchable) [size=4K]
	Bus: primary=02, secondary=03, subordinate=06, sec-latency=176
	Memory window 0: 40000000-41fff000 (prefetchable)
	Memory window 1: 46000000-47fff000 (prefetchable)
	I/O window 0: 00004000-000040ff
	I/O window 1: 00004400-000044ff
	BridgeCtl: Parity- SERR- ISA- VGA- MAbort- >Reset+ 16bInt+ PostWrite-
	16-bit legacy interface ports at 0001

0000:02:06.1 CardBus bridge: O2 Micro, Inc. OZ711M1/MC1 4-in-1 MemoryCardBus Controller (rev 20)
	Subsystem: Acer Incorporated [ALI]: Unknown device 001f
	Control: I/O+ Mem+ BusMaster+ SpecCycle- MemWINV- VGASnoop- ParErr- Stepping+ SERR- FastB2B-
	Status: Cap+ 66MHz- UDF- FastB2B- ParErr- DEVSEL=slow >TAbort- <TAbort- <MAbort- >SERR- <PERR-
	Latency: 64
	Interrupt: pin A routed to IRQ 10
	Region 0: Memory at d020a000 (32-bit, non-prefetchable) [size=4K]
	Bus: primary=02, secondary=07, subordinate=0a, sec-latency=176
	Memory window 0: 42000000-43fff000 (prefetchable)
	Memory window 1: 48000000-49fff000
	I/O window 0: 00004800-000048ff
	I/O window 1: 00004c00-00004cff
	BridgeCtl: Parity- SERR- ISA- VGA- MAbort- >Reset- 16bInt- PostWrite-
	16-bit legacy interface ports at 0001

0000:02:06.2 System peripheral: O2 Micro, Inc. OZ711Mx 4-in-1 MemoryCardBus Accelerator
	Subsystem: Acer Incorporated [ALI]: Unknown device 001f
	Control: I/O+ Mem+ BusMaster- SpecCycle- MemWINV- VGASnoop- ParErr- Stepping- SERR+ FastB2B-
	Status: Cap+ 66MHz- UDF- FastB2B- ParErr- DEVSEL=slow >TAbort- <TAbort- <MAbort- >SERR- <PERR-
	Interrupt: pin A routed to IRQ 10
	Region 0: Memory at d0208000 (32-bit, non-prefetchable) [size=4K]
	Capabilities: [a0] Power Management version 2
		Flags: PMEClk- DSI- D1+ D2+ AuxCurrent=0mA PME(D0+,D1+,D2+,D3hot+,D3cold+)
		Status: D0 PME-Enable- DSel=0 DScale=0 PME-

0000:02:07.0 FireWire (IEEE 1394): Texas Instruments TSB43AB21 IEEE-1394a-2000 Controller (PHY/Link) (prog-if 10 [OHCI])
	Subsystem: Acer Incorporated [ALI]: Unknown device 001f
	Control: I/O- Mem+ BusMaster+ SpecCycle- MemWINV+ VGASnoop- ParErr- Stepping- SERR+ FastB2B-
	Status: Cap+ 66MHz- UDF- FastB2B- ParErr- DEVSEL=medium >TAbort- <TAbort- <MAbort- >SERR- <PERR-
	Latency: 64 (500ns min, 1000ns max), Cache Line Size: 0x08 (32 bytes)
	Interrupt: pin A routed to IRQ 10
	Region 0: Memory at d0209000 (32-bit, non-prefetchable) [size=2K]
	Region 1: Memory at d0200000 (32-bit, non-prefetchable) [size=16K]
	Capabilities: [44] Power Management version 2
		Flags: PMEClk- DSI- D1+ D2+ AuxCurrent=0mA PME(D0+,D1+,D2+,D3hot+,D3cold-)
		Status: D0 PME-Enable- DSel=0 DScale=0 PME+

